{"schema_version":"2.0","tenant_id":"00000000-0000-0000-0000-000000000001","site_id":"00000000-0000-0000-0000-000000000002","device_id":"00000000-0000-0000-0000-000000000003","revision":11,"catalog_version":"2026.10.21.1","selections":[{"point_key":"wago.pm495.karte[1].frequency","cadence_s":60,"entity_id":"00000000-0000-0000-0000-00000000c495"},{"point_key":"deye.hybrid_1p.battery.battery","cadence_s":10}],"registerbilder":[{"entity_id":"00000000-0000-0000-0000-00000000c495","basisadresse":4096,"funktionscode":4,"wortfolge":"little","kartenzahl":2,"karten":[{"steckplatz":2,"kartentyp":494},{"steckplatz":3,"kartentyp":495}]}]}
