{"schema_version":"2.0","tenant_id":"00000000-0000-0000-0000-000000000001","site_id":"00000000-0000-0000-0000-000000000002","device_id":"00000000-0000-0000-0000-000000000003","revision":8,"catalog_version":"2026.10.21.1","selections":[{"point_key":"custom.sim.soc","cadence_s":10,"definition":{"label":"Ladezustand (Simulator)","sourceKind":"modbus_holding","address":4,"selector":"holding:0x0004","valueType":"uint16","widthBits":16,"signed":false,"endian":"big","scale":0.1,"unit":"%","cadenceS":10,"retentionClass":"unclassified","readOnly":true,"requestCostMs":400}}]}