{"schema_version":"2.0","tenant_id":"00000000-0000-0000-0000-000000000001","site_id":"00000000-0000-0000-0000-000000000002","device_id":"00000000-0000-0000-0000-000000000003","revision":9,"catalog_version":"2026.10.21.1","selections":[{"point_key":"deye.hybrid_1p.battery.battery","cadence_s":10,"entity_id":"00000000-0000-0000-0000-0000000000a1"},{"point_key":"deye.hybrid_1p.battery.battery-voltage","cadence_s":30}]}