{"schema_version":"2.0","tenant_id":"00000000-0000-0000-0000-000000000001","site_id":"00000000-0000-0000-0000-000000000002","device_id":"00000000-0000-0000-0000-000000000003","revision":12,"catalog_version":"2026.10.21.1","selections":[{"point_key":"erzeuger.wirkung.quelle_p","cadence_s":5,"entity_id":"00000000-0000-0000-0000-0000000e2001"},{"point_key":"erzeuger.nb.n_p_prozent","cadence_s":5,"entity_id":"00000000-0000-0000-0000-0000000e2001"},{"point_key":"erzeuger.te[2].t_p_ist_w","cadence_s":5,"entity_id":"00000000-0000-0000-0000-0000000e2001"},{"point_key":"erzeuger.nb.n_zaehler","cadence_s":60,"entity_id":"00000000-0000-0000-0000-0000000e2001"}],"erzeuger_registerbilder":[{"entity_id":"00000000-0000-0000-0000-0000000e2001","basisadresse":0,"funktionscode":4,"wortfolge":"big","te_anzahl":3,"anlagenart":"pv","veraltet_netzpunkt_s":30}]}
